Location Name,Latitude,Longitude
"LaGuardia Airport, LaGuardia Road, Queens County, City of New York, New York, 11371, United States",40.7757145,-73.87336398511545
"Terrace, Regional District of Kitimat-Stikine, British Columbia, Canada",54.5172715,-128.599548
"نيالا, جنوب دارفور, السودان",12.0505098,24.8795115
"Grand Canyon National Park Airport, State Highway 64, Tusayan, Coconino County, Arizona, 86023, United States",35.9525161,-112.14520362936864
"Семёновка, Мысовское сельское поселение, Ленинский район, Автономна Республіка Крим, 298211, Україна",45.3828,35.7657
"Perth County, Ontario, Canada",43.4935991,-81.0164111
"Uncertain, Harrison County, Texas, United States",32.7120883,-94.1212966
"Urpay, Acos Vinchos, Huamanga, Ayacucho, Perú",-13.1424738,-74.0814568
"Lacey Township, Ocean County, New Jersey, United States",39.8726184,-74.2951444
"Ленинакан, Краснокрымское сельское поселение, Мясниковский район, Ростовская область, Южный федеральный округ, 346815, Россия",47.3079286,39.6433401
"Monrovia, Greater Monrovia, Montserrado County, Liberia",6.328034,-10.797788
"Bardufoss, Målselv, Troms og Finnmark, Norge",69.065637,18.5159237
"Albania, Caquetá, RAP Amazonía, Colombia",1.2315264,-75.89204331320687
"서울특별시, 대한민국",37.5666791,126.9782914
"Bogotá, Distrito Capital, RAP (Especial) Central, Colombia",4.6529539,-74.0835643
"Parroquia Charallave, Municipio Cristóbal Rojas, Miranda, Venezuela",10.2456598,-66.8586608
"Block Island, New Shoreham, South County, Rhode Island, 02807, United States",41.18957715,-71.56790006923444
"Patuxent, Charles County, Maryland, 20637, United States",38.5392883,-76.748577
"Pasco, Franklin County, Washington, 99301, United States",46.2306739,-119.0921
"Milford Sound / Piopiotahi, Fiordland Community, Southland District, Southland, New Zealand / Aotearoa",-44.61901895,167.8687603063546
"Cerro Piedra Blanca, Salitral, Cantón Santa Ana, Provincia San José, 10902, Costa Rica",9.8729018,-84.1488124
"Ansonia, Darke County, Ohio, United States",40.214492,-84.6369011
"Village of Cove Neck, Town of Oyster Bay, Nassau County, New York, United States",40.8823207,-73.5059562
"Burlington, Colchester, Chittenden County, Vermont, United States",44.4761601,-73.212906
"Plattsburg Street, Dongan Hills, Staten Island, Richmond County, City of New York, New York, 10304, United States",40.5918973,-74.099136
"Bauru, Região Imediata de Bauru, Região Geográfica Intermediária de Bauru, São Paulo, Região Sudeste, Brasil",-22.3218102,-49.0705863
"Bangalore Wheels Yamaha Showroom, Chord Road, Cholourpalya, Dasarahalli, Bengaluru, Bangalore North, Bengaluru Urban, Karnataka, 560040, India",12.973835,77.547621
"Denver, Colorado, United States",39.7392364,-104.984862
"Off-White, 127, Northeast 41st Street, Buena Vista, Miami, Miami-Dade County, Florida, 33137, United States",25.8143476,-80.1929369
"Las Mesitas, San Francisco del Valle, Ocotepeque, Honduras",14.4249905,-88.9660592
"Santiago de Cuba, Cuba",20.0214637,-75.8294928
"کابل, کابل ښاروالۍ, ولایت كابل, 1001, افغانستان",34.5260109,69.1776838
"Juiz de Fora, Região Geográfica Imediata de Juiz de Fora, Região Geográfica Intermediária de Juiz de Fora, Minas Gerais, Região Sudeste, Brasil",-21.7609533,-43.3501129
"Tarbert Mews, Seven Sisters, West Green, London Borough of Haringey, London, Greater London, England, N15 5AB, United Kingdom",51.5833084,-0.0796862
"Ciudad de Guatemala, Departamento de Guatemala, Guatemala",14.6424667,-90.5131361
"Tuxtla Gutiérrez, Chiapas, 29019, México",16.753801,-93.115959
"Manila, Capital District, Metro Manila, Philippines",14.5906346,120.9799964
"Manila, Capital District, Metro Manila, Philippines",14.5906346,120.9799964
"Oxfordshire, England, United Kingdom",51.833333,-1.25
"Ashford, Pierce County, Washington, 98330, United States",46.758944,-122.031623
"雲林縣, 臺灣",23.6990775,120.5245511
"Elkhorn, Walworth County, Wisconsin, 53121, United States",42.6727927,-88.5445447
"Lata Terrace, Milledgeville, Baldwin County, Georgia, 31061, United States",33.096874,-83.247744
"Kaltag, Unorganized Borough, Alaska, 99748, United States",64.3276089,-158.7254198
"Tablelands - Off Trail Hike, Newfoundland, Newfoundland and Labrador, Canada",49.4551415,-57.9698532
"Кольцово, Арамильский тракт, Октябрьский район, Екатеринбург, городской округ Екатеринбург, Свердловская область, Уральский федеральный округ, 620910, Россия",56.74457635,60.802790165728474
"San Luis Obispo County, California, United States",35.3540209,-120.375716
"广州市, 广东省, 中国",23.1301964,113.2592945
"Cape Canaveral, Brevard County, Florida, United States",28.4513556,-80.5283059
"Santiago de Cuba, Cuba",20.0214637,-75.8294928
"городской округ Новосибирск, Новосибирская область, Сибирский федеральный округ, Россия",55.0288307,82.9226887
"Stadelberg, Au TG, Fischingen, Bezirk Münchwilen, Thurgau, 8376, Schweiz/Suisse/Svizzera/Svizra",47.4007479,8.956141
"Cleveland, Cuyahoga County, Ohio, United States",41.4996574,-81.6936772
"เกาะสมุย, จังหวัดสุราษฎร์ธานี, ประเทศไทย",9.50139445,99.99561927320003
"Mini autodromo Il Pozzo Off-Road, Via Senio, Poggiolino, Riolo Terme, Unione della Romagna Faentina, Ravenna, Emilia-Romagna, 48025, Italia",44.272907399999994,11.717918419933387
"Romulus, Wayne County, Michigan, United States",42.2222614,-83.3965995
"Nairobi, Kenya",-1.3026148499999999,36.82884201813725
"Jalaludin, 32, Rindu Hati, Bengkulu Tengah, Bengkulu, Sumatera, Indonesia",-3.7109609,102.52508604705358
"Los Angeles International Airport, Colegio Drive, Westchester, Los Angeles, California, 90045, United States",33.94216754999999,-118.42135906141587
"Munford, Talladega County, Alabama, United States",33.5298282,-85.9508006
"Aspen, Pitkin County, Colorado, United States",39.1911128,-106.82356
"Puerto Williams, Cabo de Hornos, Provincia de la Antártica Chilena, Región de Magallanes y de la Antártica Chilena, Chile",-54.935761,-67.6061824
"La Puerta, Parroquia Aguedo Felipe Alvarado, Municipio Iribarren, Lara, Venezuela",10.2274108,-69.4842128
"Haßfurt, Landkreis Haßberge, Bayern, 97437, Deutschland",50.0318698,10.5065562
"San Diego, San Diego County, California, United States",32.7174202,-117.162772
"Malanje, Angola",-9.535332,16.9364293
"Rua Nova Brasillia, Itaparica, Região Geográfica Imediata de Nazaré – Maragogipe, Região Metropolitana de Salvador, Região Geográfica Intermediária de Santo Antônio de Jesus, Bahia, Região Nordeste, 44460-000, Brasil",-12.8940269,-38.6771549
"Treasure Cay, North Abaco, The Bahamas",26.6774884,-77.2895287
"رأس المشب, 611, الخفجي, محافظة الخفجي, المنطقة الشرقية, السعودية",28.0761026,48.61357487036152
"Sycuan Off-Reservation Trust Land, Sycuan / Sekwan, San Diego County, California, United States",32.77850745,-116.86097371330433
"Navoiy Viloyati, Oʻzbekiston",42.0,64.0
"Bangalore Wheels Yamaha Showroom, Chord Road, Cholourpalya, Dasarahalli, Bengaluru, Bangalore North, Bengaluru Urban, Karnataka, 560040, India",12.973835,77.547621
"Thutade Lake, Area B (Finlay Valley/Beatton Valley), Peace River Regional District, British Columbia, Canada",56.9281503,-126.8875119363076
"Marion, Guilford Township, Franklin County, Pennsylvania, 17235, United States",39.8573144,-77.6952703
"Brunswick, Glynn County, Georgia, United States",31.1499528,-81.4914894
"Sulawesi, Indonesia",-1.9758004,120.29488558399481
"کرمانشاه, بخش مرکزی کرمانشاه, شهرستان کرمانشاه, استان کرمانشاه, ایران",34.3239414,47.0735891
"Luanda, Município de Luanda, Luanda, Angola",-8.8272699,13.2439512
"Perímetro Urbano Yopal, Yopal, Casanare, RAP Llanos, Colombia",5.3356662,-72.3936931
"Bellavista Airport, Calle Iglesia, Jeberos, Alto Amazonas, Loreto, Perú",-5.2883902,-76.292099
"Birmingham, Jefferson County, Alabama, United States",33.5206824,-86.8024326
"جدة, محافظة جدة, منطقة مكة المكرمة, 23434, السعودية",21.5810088,39.1653612
"Guadalcanal Island, Guadalcanal, Solomon Islands",-9.59842095,160.1485117018448
"Detroit, Wayne County, Michigan, United States",42.3315509,-83.0466403
"Salmon, Lemhi County, Idaho, 83467, United States",45.1759213,-113.895773
"Rarotonga, Kūki ʻĀirani",-21.236831199999997,-159.77747437744517
"Gustavus, Unorganized Borough, Alaska, 99826, United States",58.422398799999996,-135.7462276690827
"Imphal, Lamphelpat, Imphal West District, Manipur, 795001, India",24.7991162,93.9364419
"Ketchikan, Ketchikan Gateway, Alaska, 99901, United States",55.3430696,-131.6466819
"Walton, Lane County, Oregon, United States",44.0307442,-123.5853932
"Long Seridan, Bario, Miri, Bahagian Miri, Sarawak, Malaysia",3.977604,115.0689841
"Sampit, Kotawaringin Timur, Kalimantan Tengah, Kalimantan, 74322, Indonesia",-2.5389113,112.949389
"Baranquilla Cuidad Educadora, Calle 58, Modelo, Localidad Norte - Centro Histórico, Perímetro Urbano Barranquilla, Barranquilla, Atlántico, RAP Caribe, 080003, Colombia",10.99773435,-74.7911478441537
"Chatanga, сельское поселение Хатанга, Таймырский Долгано-Ненецкий район, Красноярский край, Сибирский федеральный округ, Россия",72.2404127,102.8645892
"RPTRA Muara Condet, Batu Ampar, Kramat Jati, Jakarta Timur, Daerah Khusus Jakarta, Jawa, Indonesia",-6.277306299999999,106.85820814173053
"Katapang, Bandung, Jawa Barat, Jawa, 40921, Indonesia",-7.0050463,107.5499739
"Tumbang Miri, Gunung Mas, Kalimantan Tengah, Kalimantan, Indonesia",-0.9160201,113.5526778
"Vallejo, Solano County, California, United States",38.1040864,-122.2566367
"Recife, Região Geográfica Imediata do Recife, Região Metropolitana do Recife, Região Geográfica Intermediária do Recife, Pernambuco, Região Nordeste, Brasil",-8.0584933,-34.8848193
"Davis, Yolo County, California, United States",38.5435526,-121.739005
"Sena, Caia, Sofala, Moçambique",-17.445439,35.029225
"Guaratinguetá, Região Imediata de Guaratinguetá, Região Metropolitana do Vale do Paraíba e Litoral Norte, Região Geográfica Intermediária de São José dos Campos, São Paulo, Região Sudeste, Brasil",-22.8057839,-45.1908926
"Travelodge Las Vegas Airport North/Near the Strip, Koval Lane, Paradise, Clark County, Nevada, 89158, United States",36.098267750000005,-115.16411744999999
"Rome, Floyd County, Georgia, United States",34.257038,-85.1646726
"Heidelberg, Baden-Württemberg, Deutschland",49.4093582,8.694724
"Stockholms kommun, Solna kommun, Stockholms län, Sverige",59.3251172,18.0710935
"萬里區, 新北市, 臺灣",25.181234,121.688687
"Gabriels, Town of Brighton, Franklin County, New York, 12939, United States",44.4319972,-74.1809887
"Temple Bar, Mohave County, Arizona, United States",36.0344373,-114.3223481
"Nanaimo, Regional District of Nanaimo, British Columbia, Canada",49.163877,-123.938122
"Caetité, Região Geográfica Imediata de Guanambi, Região Geográfica Intermediária de Guanambi, Bahia, Região Nordeste, Brasil",-14.0691776,-42.4852428
"Evansville, Vanderburgh County, Indiana, United States",37.970495,-87.5715641
"Toledo, Lucas County, Ohio, United States",41.6529143,-83.5378173
"Beni, Bolivia",-14.0,-65.0
"Etsouali, Djambala, Plateaux, Congo",-2.8561907,15.5493267
"LaGuardia Airport, LaGuardia Road, Queens County, City of New York, New York, 11371, United States",40.7757145,-73.87336398511545
"Αθήνα, Δήμος Αθηναίων, Περιφερειακή Ενότητα Κεντρικού Τομέα Αθηνών, Περιφέρεια Αττικής, Αποκεντρωμένη Διοίκηση Αττικής, 105 57, Ελλάς",37.9755648,23.7348324
"Nairobi, Kenya",-1.3026148499999999,36.82884201813725
"Hamburg, Berks County, Pennsylvania, 19526, United States",40.5555764,-75.9822929
"Perris Valley Storm Drain, Perris, Riverside County, California, United States",33.8349024,-117.2126222
"Haleakalā Observatories, Maui County, Hawaii, United States",20.7076743,-156.2575841
"ساوه, بخش مرکزی شهرستان ساوه, شهرستان ساوه, استان مرکزی, ایران",35.0196331,50.3652364
"Blewett Falls Lake, Anson County, North Carolina, United States",35.02233675,-79.8935048896999
"Tucutí, Distrito Chepigana, Darién, Panamá",7.9601443,-77.9327624
"Mayagüez, Puerto Rico, United States",18.2011161,-67.1391124
"Anniston, Calhoun County, Alabama, United States",33.6624824,-85.8283224
"Meadview, Mohave County, Arizona, United States",36.0022091,-114.0682936
"Cruzeiro do Sul, Região Geográfica Imediata de Lajeado, Região Geográfica Intermediária de Santa Cruz do Sul - Lajeado, Rio Grande do Sul, Região Sul, 95930-970, Brasil",-29.5139742,-51.9917068
"Saint Thomas, Charlotte Amalie, Saint Thomas - Saint John District, United States Virgin Islands, United States",18.34290815,-64.91889970060265
"Bethel, Unorganized Borough, Alaska, United States",60.7922222,-161.755833
"თბილისი, საქართველო",41.6934591,44.8014495
"Matka canyon viewpoint near golden cross, Path to Golden Cross, Матка, Општина Сарај, Град Скопје, Скопски СР, Северна Македонија",41.961308,21.292864
"Iguape, Região Imediata de Registro, Região Geográfica Intermediária de Sorocaba, São Paulo, Região Sudeste, 11920-000, Brasil",-24.7042692,-47.5563733
"Adjuntas, Puerto Rico, United States",18.1625596,-66.7231363
"John F. Kennedy International Airport, JFK Access Road, Queens, City of New York, New York, 11430, United States",40.642947899999996,-73.7793733748521
"南京市, 江苏省, 中国",32.0438284,118.7788631
"Colorado, Municipio Pojo, Carrasco, Cochabamba, Bolivia",-17.5429363,-64.7991084
"Hot Springs, Black River Road, Greenlee County, Arizona, United States",33.0479902,-109.4410421
"Gimli, Division No. 18, Manitoba, R0C 1B0, Canada",50.6323125,-96.9881076
El Salvador,13.8000382,-88.9140683
"Jamba, Huíla, Angola",-14.6902435,16.0305922
"Hinckley, Squaw Grove Township, DeKalb County, Illinois, 60520, United States",41.7689183,-88.640913
"Bellavista, San Martín, Perú",-7.6842476,-76.3153378
"Козырёвск, Козыревское сельское поселение, Усть-Камчатский район, Камчатский край, Дальневосточный федеральный округ, Россия",56.0498765,159.8703005
"Hana, Maui County, Hawaii, United States",20.7671042,-155.990751995403
"Bogotá, Distrito Capital, RAP (Especial) Central, Colombia",4.6529539,-74.0835643
"Amsterdam, Noord-Holland, Nederland",52.3730796,4.8924534
"Bath (Berkeley Springs), Morgan County, West Virginia, United States",39.6267975,-78.2279514
"Muqdisho مقديشو, Hamar Weyne حي حمروين, Banaadir بنادر, BN 09010, Soomaaliya الصومال",2.0349312,45.3419183
"structure near farm, Gang Melati, Cipareuan, Garut, Jawa Barat, Jawa, 44152, Indonesia",-7.0842322499999995,107.91500763037543
"Чита, городской округ Чита, Забайкальский край, Дальневосточный федеральный округ, 672000, Россия",52.033409,113.500893
"Grand Junction, Mesa County, Colorado, United States",39.0672568,-108.56448
"Kiana, Northwest Arctic, Alaska, 99749, United States",66.970399,-160.43845255182214
"Off Veera Desai Road, Jeevan Nagar, K/W Ward, Zone 3, Mumbai, Mumbai Suburban, Maharashtra, 400047, India",19.1319235,72.8344524
"Elk City, Idaho County, Idaho, 83525, United States",45.8268527,-115.4367941
"Uruapan, Michoacán, México",19.4060961,-102.03430719292024
"Goma, Nord-Kivu, République démocratique du Congo",-1.6665685,29.225652
"طرابلس, ليبيا",32.896672,13.1777923
"Paris, Île-de-France, France métropolitaine, France",48.8534951,2.3483915
"Surabaya, Jawa Timur, Jawa, Indonesia",-7.2459717,112.7378266
"Sellafield, Sellafield Road, Beckermet, Cumberland, England, CA20 1DS, United Kingdom",54.4166451,-3.5104538
"Sumatera, Indonesia",0.1498584,102.8197858481398
"Bogotá, Distrito Capital, RAP (Especial) Central, Colombia",4.6529539,-74.0835643
"Скопје, Општина Центар, Град Скопје, Скопски СР, Северна Македонија",41.9961816,21.4319213
"Grants, Cibola County, New Mexico, 87020, United States",35.14726,-107.851446
"Dagali, Hol, Viken, Norge",60.4114528,8.4408805
"Anchorage, Alaska, 99501, United States",61.2163129,-149.894852
"Aspen, Pitkin County, Colorado, United States",39.1911128,-106.82356
"Zwingle, Dubuque County, Iowa, United States",42.2975404,-90.6875607
"Aurangabad, Chhatrapati Sambhajinagar, Maharashtra, 431002, India",19.877263,75.3390241
"Shelton, Buffalo County, Nebraska, 68876, United States",40.7806605,-98.7341271
"Suva, Rewa, Central, Viti",-18.1415884,178.4421662
"Perímetro Urbano Yopal, Yopal, Casanare, RAP Llanos, Colombia",5.3356662,-72.3936931
"Gulgubip Airport, Western, Southern Region, Papua Niugini",-5.2804449,141.54123343874267
"Nabire, Kabupaten Nabire, Papua Tengah, Western New Guinea, 98811, Indonesia",-3.360285,135.5023653
"Las Vegas, Clark County, Nevada, United States",36.1672559,-115.148516
"Talladega County, Alabama, United States",33.3967079,-86.1597137
"银川市, 宁夏回族自治区, 中国",38.4852037,106.2261926
"해남군, 전라남도, 59043, 대한민국",34.5734106,126.5989275
"Lorong Serawak, Taman Melawati, Ulu Kelang, Majlis Perbandaran Ampang Jaya, Gombak, 53100, Malaysia",3.2108548,101.7491679
"Devghat, तनहुँ, गण्डकी प्रदेश, नेपाल",27.8104986,84.36710139483444
"Augusta, Richmond County, Georgia, United States",33.4709714,-81.9748429
"Warszawa, województwo mazowieckie, Polska",52.2337172,21.071432235636493
"Аҟәа - Сухум, აფხაზეთის ავტონომიური რესპუბლიკა - Аҧсны Автономтә Республика, Абхазия - Аԥсны, საქართველო",43.0033629,41.0192741
"Аҟәа - Сухум, აფხაზეთის ავტონომიური რესპუბლიკა - Аҧсны Автономтә Республика, Абхазия - Аԥсны, საქართველო",43.0033629,41.0192741
"Аҟәа - Сухум, აფხაზეთის ავტონომიური რესპუბლიკა - Аҧсны Автономтә Республика, Абхазия - Аԥсны, საქართველო",43.0033629,41.0192741
"Summer house on a hill near Shov, ქუთაისი-ალპანა-მამისონის უღელტეხილი, გლოლა, ონის მუნიციპალიტეტი, რაჭა-ლეჩხუმი და ქვემო სვანეთი, საქართველო",42.7026025,43.6319258
"Franz Josef Glacier / Kā Roimata o Hine Hukatere, Westland District, West Coast, New Zealand / Aotearoa",-43.475736850000004,170.19813697640626
"抚州市, 钟岭街道, 金巢开发区, 临川区, 抚州市, 江西省, 中国",27.9511188,116.3530413
"Greensburg, Decatur County, Indiana, 47240, United States",39.3372722,-85.483581
"ᓀᑲᣞ ᓵᑲᐦᐃᑲᓃᐣᐠ Sandy Lake, Kenora District, Northwestern Ontario, Ontario, Canada",53.061025,-93.321991
"乌鲁木齐县, 乌鲁木齐市 ئۈرۈمچى, 新疆维吾尔自治区 شىنجاڭ ئۇيغۇر ئاپتونوم رايونی, 830000, 中国",43.419754,87.319461
"Hibbing, Saint Louis County, Minnesota, 55746, United States",47.427155,-92.937689
"ຖະຫນົນ ໂພນສະຫວັນ, Saphanthong Village, ວຽງຈັນ, Sisattanāk, ນະຄອນຫຼວງວຽງຈັນ, 01030, ປະເທດລາວ",17.948759,102.624672
"Santa Ana, Orange County, California, United States",33.7494951,-117.873221
"Գյումրի, Գյումրի-Ախուրյան սահման, Շիրակի մարզ, Հայաստան",40.78413735,43.84394146962765
"Okeechobee County, Florida, United States",27.3923408,-80.8873655
"Columbus, Franklin County, Ohio, United States",39.9622601,-83.0007065
"Нальчик, городской округ Нальчик, Кабардино-Балкария, Северо-Кавказский федеральный округ, Россия",43.4769604,43.5966578
"East Midlands, England, United Kingdom",52.7965611,-0.6717947564067988
"City of New York, New York, United States",40.7127281,-74.0060152
"New Delhi District, Delhi, India",28.6138954,77.2090057
"Spokane, Spokane County, Washington, United States",47.6571934,-117.42351
"Key West, Monroe County, Florida, United States",24.5548262,-81.8020722
"Weipa, Weipa Town, Queensland, 4874, Australia",-12.6386641,141.8710861
"Lamoille, Elko County, Nevada, 89828, United States",40.7279826,-115.478392
"Amsterdam, Noord-Holland, Nederland",52.3730796,4.8924534
"Ambato, Tungurahua, Ecuador",-1.2422413,-78.6287594
"Kigali, Akarere ka Nyarugenge, Umujyi wa Kigali, Rwanda",-1.950851,30.061507
"Northern, شارع المجموعة الثقافية, محلة 313, حي الأندلس, الموصل, ناحية مرکز قضاء الموصل, قضاء الموصل, محافظة نینوى, 41003, العراق",36.3813948,43.1329532
"Nanga Pinoh, Melawi, Kalimantan Barat, Kalimantan, 79672, Indonesia",-0.3316049,111.7370026
"Stratford, Greater Bridgeport Planning Region, Connecticut, United States",41.1845415,-73.1331651
"São Gabriel, Região Geográfica Imediata de São Gabriel - Caçapava do Sul, Região Geográfica Intermediária de Santa Maria, Rio Grande do Sul, Região Sul, Brasil",-30.334214,-54.3227149
"Loma Linda, El Paso, Cesar, RAP Caribe, Colombia",9.8330548,-73.7885558
"Kodiak, Kodiak Island, Alaska, 99615, United States",57.79,-152.407222
"Chantilly, Fairfax County, Virginia, United States",38.8788355,-77.40221718011088
"Kalora, Poso, Sulawesi Tengah, Sulawesi, Indonesia",-1.2360888,120.464636
"Abidjan, Le Plateau, Abidjan, Côte d’Ivoire",5.320357,-4.016107
"Aéroport de Toulouse-Blagnac, Allée du Sidobre, Oratoire, Colomiers, Toulouse, Haute-Garonne, Occitanie, France métropolitaine, 31770, France",43.629977999999994,1.360809880743464
"Charlotte, Mecklenburg County, North Carolina, United States",35.2272086,-80.8430827
"Portage Creek, Unorganized Borough, Alaska, United States",58.903454499999995,-157.67807080396912
"Hanalei, Kauaʻi County, Hawaii, 96714, United States",22.2029937,-159.4956949
"Colón, Barrio Sur, Distrito Colón, Colón, 9851, Panamá",9.3553005,-79.8974085
"Kalimantan Timur, Kalimantan, Indonesia",0.7884397,116.2419977
"제주특별자치도, 대한민국",33.4887737,126.4987083
"Port Alsworth, Lake and Peninsula, Alaska, 99653, United States",60.2036369,-154.3171268
"Whiting, Manchester Township, Ocean County, New Jersey, United States",39.9545613,-74.3784815
"Kenai, Kenai Peninsula, Alaska, United States",60.5544444,-151.258333
"Fish Egg Inlet, Area A (Ocean Falls/Outer Coast), Central Coast Regional District, British Columbia, Canada",51.62226405,-127.7778120623353
"Tamanrasset, Algérie ⵍⵣⵣⴰⵢⴻⵔ الجزائر",24.3753438,4.3208436
"九龍灣 Kowloon Bay, 觀塘道 Kwun Tong Road, 牛頭角下 Lower Ngau Tau Kok, 牛頭角 Ngau Tau Kok, 觀塘區 Kwun Tong District, 九龍 Kowloon, 香港 Hong Kong, 000000, 中国",22.3231377,114.21412352083235
"Bahía Negra, Alto Paraguay, Región Occidental, Paraguay / Paraguái",-20.2308712,-58.1690716
"Buenos Aires, Região Geográfica Imediata de Carpina, Região Geográfica Intermediária do Recife, Pernambuco, Região Nordeste, Brasil",-7.7218931,-35.326587
"Lobito, Benguela, Angola",-12.3506867,13.5464318
"Mitú, Vaupés, RAP Amazonía, Colombia",1.2523268,-70.2308883
"Батагай, городское поселение Батагай, Верхоянский улус, Республика Саха (Якутия), Дальневосточный федеральный округ, Россия",67.654907,134.635071
"Roselawn, Newton County, Indiana, United States",41.1534665,-87.288704
"Avenal, Kings County, California, United States",36.0041223,-120.1290272
Papua Niugini,-5.6816069,144.2489081
"Bridgeton, Saint Louis County, Missouri, 63044, United States",38.7566055,-90.42352
"Morrisville, Wake County, North Carolina, 27650, United States",35.824341,-78.8300321
"New Guinea, Southern Region, Papua Niugini",-5.5226203,142.08711943819077
"Coventry, West Midlands Combined Authority, England, United Kingdom",52.4081812,-1.510477
"Aéroport international d'Alger Houari Boumédiene, ممر 2, Zone Industrielle de Oued Smar المنطقة الصناعية لوادي السمار, Oued Smar ⵡⴻⴷ ⵙⵎⴰⵔ وادي السمار, El Harrach, Alger, 16270, Algérie ⵍⵣⵣⴰⵢⴻⵔ الجزائر",36.7014097,3.2293304654793413
"اصفهان, بخش مرکزی شهرستان اصفهان, شهرستان اصفهان, استان اصفهان, ایران",32.6707877,51.6650002
"Cartagena de Indias, Dique, Bolívar, RAP Caribe, Colombia",10.4265566,-75.5441671
"Flagstaff, Coconino County, Arizona, United States",35.1987522,-111.651822
"Masset, North Coast Regional District, British Columbia, V0T 1M0, Canada",54.0124473,-132.1452236
"Pleasanton, Alameda County, California, United States",37.6624312,-121.8746789
"Blyn, Clallam County, Washington, United States",48.0216921,-123.0057095
"Los Angeles, Los Angeles County, California, United States",34.0536909,-118.242766
